{
  "$schema": "https://json-schema.org/draft/2020-12/schema",
  "$id": "urn:leamas:gate-summary:v2",
  "title": "Leamas Gate Summary v2",
  "description": "Wire schema for the Leamas Gate Summary v2 format with bounded scope and parent lifecycle state.",
  "type": "object",
  "additionalProperties": false,
  "required": [
    "schema_version",
    "generated_at",
    "scope_id",
    "scope_status",
    "scope_disposition",
    "parent_act",
    "parent_status",
    "parent_disposition",
    "overall_status",
    "overall_disposition",
    "execution_head_oid",
    "execution_tree_oid",
    "subject_tree_oid",
    "worktree_clean_before",
    "worktree_clean_after",
    "checks"
  ],
  "properties": {
    "schema_version": {
      "description": "Integer discriminator that identifies the v2 wire format. The lexical form is enforced by the pre-schema envelope scanner.",
      "type": "integer",
      "const": 2
    },
    "generated_at": {
      "description": "Non-empty RFC 3339 timestamp with explicit UTC offset emitted by the producer.",
      "type": "string",
      "minLength": 1,
      "format": "date-time"
    },
    "scope_id": {
      "description": "Stable identifier for the bounded verification scope.",
      "type": "string",
      "minLength": 1,
      "maxLength": 16384
    },
    "scope_status": {
      "description": "Lifecycle status of the bounded verification scope. Wire form is uppercase only.",
      "type": "string",
      "enum": [
        "OPEN",
        "PARTIAL",
        "CLOSED"
      ]
    },
    "scope_disposition": {
      "description": "Free-form scope disposition comment.",
      "type": "string",
      "minLength": 1,
      "maxLength": 1048576
    },
    "parent_act": {
      "description": "Parent ACT identifier. Empty string for root scopes.",
      "type": "string",
      "maxLength": 16384
    },
    "parent_status": {
      "description": "Lifecycle status of the containing parent process or activity. Independent from scope_status and overall_status.",
      "type": "string",
      "enum": [
        "OPEN",
        "PARTIAL",
        "CLOSED"
      ]
    },
    "parent_disposition": {
      "description": "Free-form parent disposition comment.",
      "type": "string",
      "minLength": 1,
      "maxLength": 1048576
    },
    "overall_status": {
      "description": "Aggregate gate status. Independent from scope_status and parent_status; the wire form does not derive one from the others.",
      "type": "string",
      "enum": [
        "pass",
        "fail",
        "unavailable"
      ]
    },
    "overall_disposition": {
      "description": "Free-form aggregate disposition comment.",
      "type": "string",
      "minLength": 1,
      "maxLength": 1048576
    },
    "execution_head_oid": {
      "description": "Git object ID for the execution head commit (40 or 64 lowercase hex characters).",
      "type": "string",
      "pattern": "^[0-9a-f]{40}$|^[0-9a-f]{64}$"
    },
    "execution_tree_oid": {
      "description": "Git tree object ID for the executed tree (40 or 64 lowercase hex characters).",
      "type": "string",
      "pattern": "^[0-9a-f]{40}$|^[0-9a-f]{64}$"
    },
    "subject_tree_oid": {
      "description": "Git tree object ID for the subject under test (40 or 64 lowercase hex characters).",
      "type": "string",
      "pattern": "^[0-9a-f]{40}$|^[0-9a-f]{64}$"
    },
    "worktree_clean_before": {
      "description": "Whether the worktree was clean before the verification began.",
      "type": "boolean"
    },
    "worktree_clean_after": {
      "description": "Whether the worktree was clean after the verification finished.",
      "type": "boolean"
    },
    "checks": {
      "description": "Ordered list of recorded checks. Producers record parent-state observations as ordinary checks with scope=parent_act.",
      "type": "array",
      "maxItems": 10000,
      "items": { "$ref": "#/$defs/check" }
    }
  },
  "$defs": {
    "gate_status": {
      "description": "Per-check gate status vocabulary.",
      "type": "string",
      "enum": [
        "pass",
        "fail",
        "skip",
        "unavailable"
      ]
    },
    "oid_hex": {
      "description": "Lowercase hex Git object ID (64 characters).",
      "type": "string",
      "pattern": "^[0-9a-f]{64}$"
    },
    "exit_code_or_null": {
      "description": "Arbitrary-precision integer exit code, or JSON null when no exit code is recorded.",
      "type": ["integer", "null"]
    },
    "extras": {
      "description": "Per-check process execution evidence.",
      "type": "object",
      "additionalProperties": false,
      "required": [
        "argv",
        "exit_code",
        "duration_ms",
        "stdout_sha256",
        "stderr_sha256"
      ],
      "properties": {
        "argv": {
          "description": "Command-line arguments of the executed process.",
          "type": "array",
          "maxItems": 1024,
          "items": {
            "type": "string",
            "maxLength": 65536
          }
        },
        "exit_code": { "$ref": "#/$defs/exit_code_or_null" },
        "duration_ms": {
          "description": "Wall-clock duration in milliseconds. Arbitrary-precision non-negative integer.",
          "type": "integer",
          "minimum": 0
        },
        "stdout_sha256": {
          "description": "Lowercase SHA-256 hex of the producer's exact stdout byte stream. The empty-stream hash is e3b0c44298fc1c149afbf4c8996fb92427ae41e4649b934ca495991b7852b855.",
          "type": "string",
          "pattern": "^[0-9a-f]{64}$"
        },
        "stderr_sha256": {
          "description": "Lowercase SHA-256 hex of the producer's exact stderr byte stream. The empty-stream hash is e3b0c44298fc1c149afbf4c8996fb92427ae41e4649b934ca495991b7852b855.",
          "type": "string",
          "pattern": "^[0-9a-f]{64}$"
        }
      }
    },
    "check": {
      "description": "Single recorded check entry.",
      "type": "object",
      "additionalProperties": false,
      "required": [
        "name",
        "scope",
        "status",
        "evidence",
        "detail",
        "extras"
      ],
      "properties": {
        "name": {
          "description": "Stable identifier for the check as emitted by the producer.",
          "type": "string",
          "minLength": 1,
          "maxLength": 1024
        },
        "scope": {
          "description": "Scope reference for the check. Use 'ROOT' for root-scope checks or the parent ACT identifier for parent-state observations.",
          "type": "string",
          "minLength": 1,
          "maxLength": 1024
        },
        "status": { "$ref": "#/$defs/gate_status" },
        "evidence": {
          "description": "Human-readable evidence pointer for the check.",
          "type": "string",
          "minLength": 1,
          "maxLength": 1048576
        },
        "detail": {
          "description": "Human-readable detail comment for the check.",
          "type": "string",
          "minLength": 1,
          "maxLength": 1048576
        },
        "extras": { "$ref": "#/$defs/extras" },
        "total": {
          "description": "Total test count for the check. Optional; if present, all five counters must be present together.",
          "type": "integer",
          "minimum": 0
        },
        "pass_count": {
          "description": "Passing test count for the check. Optional; if present, all five counters must be present together.",
          "type": "integer",
          "minimum": 0
        },
        "fail_count": {
          "description": "Failing test count for the check. Optional; if present, all five counters must be present together.",
          "type": "integer",
          "minimum": 0
        },
        "skip_count": {
          "description": "Skipped test count for the check. Optional; if present, all five counters must be present together.",
          "type": "integer",
          "minimum": 0
        },
        "unavailable_count": {
          "description": "Unavailable test count for the check. Optional; if present, all five counters must be present together.",
          "type": "integer",
          "minimum": 0
        }
      },
      "anyOf": [
        {
          "description": "All five test-count fields must be present together.",
          "required": [
            "total",
            "pass_count",
            "fail_count",
            "skip_count",
            "unavailable_count"
          ]
        },
        {
          "description": "Or none of them may be present.",
          "not": {
            "anyOf": [
              { "required": ["total"] },
              { "required": ["pass_count"] },
              { "required": ["fail_count"] },
              { "required": ["skip_count"] },
              { "required": ["unavailable_count"] }
            ]
          }
        }
      ]
    }
  }
}
