{
  "schema_version": 2,
  "generated_at": "2026-07-19T08:43:26Z",
  "scope_id": "ACT-DEMO-ROOT",
  "scope_status": "CLOSED",
  "scope_disposition": "minimal root scope example",
  "parent_act": "",
  "parent_status": "CLOSED",
  "parent_disposition": "root scope; no parent",
  "overall_status": "pass",
  "overall_disposition": "all checks passed",
  "execution_head_oid": "0123456789abcdef0123456789abcdef01234567",
  "execution_tree_oid": "0123456789abcdef0123456789abcdef01234567",
  "subject_tree_oid": "0123456789abcdef0123456789abcdef01234567",
  "worktree_clean_before": true,
  "worktree_clean_after": true,
  "checks": [
    {
      "name": "smoke",
      "scope": "ROOT",
      "status": "pass",
      "evidence": "smoke.sh",
      "detail": "smoke test passed",
      "extras": {
        "argv": ["smoke.sh"],
        "exit_code": 0,
        "duration_ms": 42,
        "stdout_sha256": "0123456789abcdef0123456789abcdef0123456789abcdef0123456789abcdef",
        "stderr_sha256": "e3b0c44298fc1c149afbf4c8996fb92427ae41e4649b934ca495991b7852b855"
      }
    }
  ]
}
