{
  "schema_version": 2,
  "generated_at": "2026-07-19T08:43:26Z",
  "scope_id": "ACT-LEAMAS-FACTORY-DIGEST-GATE-SUMMARY-V2-CONTRACT01",
  "scope_status": "CLOSED",
  "scope_disposition": "contract ACT is closed",
  "parent_act": "ACT-LEAMAS-FACTORY-GATE-SUMMARY-V2-ADOPTION01",
  "parent_status": "OPEN",
  "parent_disposition": "epic in progress; downstream ACTs pending",
  "overall_status": "pass",
  "overall_disposition": "all checks passed in this ACT",
  "execution_head_oid": "4bd2c5646f7a4d9c8e1f0123456789abcdef0123",
  "execution_tree_oid": "984aaf36abc12345def67890abcdef0123456789",
  "subject_tree_oid": "abcdef0123456789abcdef0123456789abcdef01",
  "worktree_clean_before": true,
  "worktree_clean_after": true,
  "checks": [
    {
      "name": "go_test",
      "scope": "ROOT",
      "status": "pass",
      "evidence": "go test ./...",
      "detail": "all unit tests passed",
      "extras": {
        "argv": ["go", "test", "./..."],
        "exit_code": 0,
        "duration_ms": 12345,
        "stdout_sha256": "1111111111111111111111111111111111111111111111111111111111111111",
        "stderr_sha256": "e3b0c44298fc1c149afbf4c8996fb92427ae41e4649b934ca495991b7852b855"
      },
      "total": 177,
      "pass_count": 177,
      "fail_count": 0,
      "skip_count": 0,
      "unavailable_count": 0
    },
    {
      "name": "go_vet",
      "scope": "ROOT",
      "status": "pass",
      "evidence": "go vet ./...",
      "detail": "vet reported no issues",
      "extras": {
        "argv": ["go", "vet", "./..."],
        "exit_code": 0,
        "duration_ms": 750,
        "stdout_sha256": "2222222222222222222222222222222222222222222222222222222222222222",
        "stderr_sha256": "e3b0c44298fc1c149afbf4c8996fb92427ae41e4649b934ca495991b7852b855"
      }
    },
    {
      "name": "make_factorize",
      "scope": "ROOT",
      "status": "pass",
      "evidence": "make factorize",
      "detail": "factory verifiers green",
      "extras": {
        "argv": ["make", "factorize"],
        "exit_code": 0,
        "duration_ms": 9000,
        "stdout_sha256": "3333333333333333333333333333333333333333333333333333333333333333",
        "stderr_sha256": "4444444444444444444444444444444444444444444444444444444444444444"
      }
    },
    {
      "name": "make_gate",
      "scope": "ROOT",
      "status": "skip",
      "evidence": "make gate",
      "detail": "skipped to keep fixture deterministic",
      "extras": {
        "argv": ["make", "gate"],
        "exit_code": null,
        "duration_ms": 0,
        "stdout_sha256": "e3b0c44298fc1c149afbf4c8996fb92427ae41e4649b934ca495991b7852b855",
        "stderr_sha256": "e3b0c44298fc1c149afbf4c8996fb92427ae41e4649b934ca495991b7852b855"
      }
    }
  ]
}
